{
  "$schema": "https://json-schema.org/draft/2020-12/schema",
  "$id": "https://example.org/schemas/gien-governance-event.schema.json",
  "title": "GIEN Governance Event",
  "description": "Canonical governance and supervision event record for Sentinel AI v2.4",
  "type": "object",
  "required": [
    "crs_uuid",
    "event_type",
    "timestamp_utc",
    "institution_id",
    "jurisdiction_code",
    "risk_tier",
    "model_id",
    "model_version",
    "policy_bundle_digest",
    "decision_outcome",
    "human_override_flag",
    "signature"
  ],
  "properties": {
    "crs_uuid": {
      "type": "string",
      "pattern": "^CRS-UUID-[0-9]{4}-[0-9]{2}-[0-9]{2}-[0-9]{6}$"
    },
    "event_type": {
      "type": "string",
      "enum": [
        "ai.decision",
        "ai.override",
        "ai.incident",
        "ai.attestation"
      ]
    },
    "timestamp_utc": {
      "type": "string",
      "format": "date-time"
    },
    "institution_id": {
      "type": "string",
      "minLength": 3
    },
    "jurisdiction_code": {
      "type": "string",
      "minLength": 2,
      "maxLength": 8
    },
    "risk_tier": {
      "type": "string",
      "enum": [
        "TIER_0",
        "TIER_1",
        "TIER_2",
        "TIER_3"
      ]
    },
    "model_id": {
      "type": "string"
    },
    "model_version": {
      "type": "string"
    },
    "prompt_hash": {
      "type": "string"
    },
    "context_hash": {
      "type": "string"
    },
    "policy_bundle_digest": {
      "type": "string"
    },
    "decision_outcome": {
      "type": "string"
    },
    "human_override_flag": {
      "type": "boolean"
    },
    "signature": {
      "type": "string"
    }
  },
  "additionalProperties": false
}
